{"artifactId":"46634047-d451-4ffe-86f5-ee1825df8d08","observedSet":{"artifactId":"46634047-d451-4ffe-86f5-ee1825df8d08","baseSliceCadenceMs":1000,"dataCustodyMode":"protected_external","eventGroupingMode":"fixed_raw_count","eventGroupingSizeRawSlices":10,"observedDurationMs":30000,"observedEventCount":300,"observedSetId":"46634047-d451-4ffe-86f5-ee1825df8d08-observed","primeSafeInspectionMode":"metadata_only","protectedEvidenceRefs":[{"digestSha256":"c5833d543c20b4e9b9e2b008ed804e97aab88f8eebb020df01662cbab9bfebfa","pointerUri":"custody://observed/root","refId":"observed-root","summary":"Observed-set custody root"}],"rawSliceCount":30},"schema":"oan.hopng_event_slice","schemaVersion":"0.1.0","slices":[{"artifactId":"46634047-d451-4ffe-86f5-ee1825df8d08","eventSliceId":"event-0","n":0,"observedEventCount":120,"protectedEvidenceRefs":[{"digestSha256":"76676332cfa313b586ed553364beab22b7ea28c0204dd4d07aa138d9fdd2feea","pointerUri":"custody://observed/event-0","refId":"event-0","summary":"Protected evidence for event-0"}],"rawEndN":9,"rawSliceSpan":10,"rawStartN":0,"sliceDigest":"c4b5fbea3ae8eebaa20326783e4aef3a7ca5121f192c3e2456ad37191f47c831","timestampEndUtc":"2026-03-07T00:00:10\u002B00:00","timestampStartUtc":"2026-03-07T00:00:00\u002B00:00","universeStates":{"cryptic-support":{"bloom":0.5,"drift":0.2,"pressure":0.3},"prime-projection":{"bloom":0.4,"drift":0.1,"pressure":0.2}}},{"artifactId":"46634047-d451-4ffe-86f5-ee1825df8d08","eventSliceId":"event-1","n":1,"observedEventCount":90,"protectedEvidenceRefs":[{"digestSha256":"7a3c2ec43254af940fb2ea1bc28af1d1d76fa0d5dd07aba2a5703723021d2786","pointerUri":"custody://observed/event-1","refId":"event-1","summary":"Protected evidence for event-1"}],"rawEndN":19,"rawSliceSpan":10,"rawStartN":10,"sliceDigest":"1c48f9d48040c0cd385a53d87f75d0ad9cd434745c16592718fa44b66f577eb6","timestampEndUtc":"2026-03-07T00:00:20\u002B00:00","timestampStartUtc":"2026-03-07T00:00:10\u002B00:00","universeStates":{"cryptic-support":{"bloom":0.4,"drift":0.1,"pressure":0.1},"prime-projection":{"bloom":0.7,"drift":0.3,"pressure":0.45}}},{"artifactId":"46634047-d451-4ffe-86f5-ee1825df8d08","eventSliceId":"event-2","n":2,"observedEventCount":90,"protectedEvidenceRefs":[{"digestSha256":"a216c2c3222b04b201c3de1ad01d5af6ffab2369080cbfd9229717c6715df6c0","pointerUri":"custody://observed/event-2","refId":"event-2","summary":"Protected evidence for event-2"}],"rawEndN":29,"rawSliceSpan":10,"rawStartN":20,"sliceDigest":"0943d2f4ce419617e6e0a1dc5d08abc730f305206f74fbc9fb5438eb2e181e84","timestampEndUtc":"2026-03-07T00:00:30\u002B00:00","timestampStartUtc":"2026-03-07T00:00:20\u002B00:00","universeStates":{"cryptic-support":{"bloom":0.65,"drift":0.3,"pressure":0.4},"prime-projection":{"bloom":0.9,"drift":0.35,"pressure":0.5}}}]}