{"artifactId":"71ee9640-daa7-4abd-8980-83bc53607f14","observedSet":{"artifactId":"71ee9640-daa7-4abd-8980-83bc53607f14","baseSliceCadenceMs":1000,"dataCustodyMode":"protected_external","eventGroupingMode":"fixed_raw_count","eventGroupingSizeRawSlices":10,"observedDurationMs":40000,"observedEventCount":420,"observedSetId":"71ee9640-daa7-4abd-8980-83bc53607f14-observed","primeSafeInspectionMode":"metadata_only","protectedEvidenceRefs":[{"digestSha256":"c5833d543c20b4e9b9e2b008ed804e97aab88f8eebb020df01662cbab9bfebfa","pointerUri":"custody://observed/root","refId":"observed-root","summary":"Observed-set custody root"}],"rawSliceCount":40},"schema":"oan.hopng_event_slice","schemaVersion":"0.1.0","slices":[{"artifactId":"71ee9640-daa7-4abd-8980-83bc53607f14","eventSliceId":"event-0","n":0,"observedEventCount":120,"protectedEvidenceRefs":[{"digestSha256":"76676332cfa313b586ed553364beab22b7ea28c0204dd4d07aa138d9fdd2feea","pointerUri":"custody://observed/event-0","refId":"event-0","summary":"Protected evidence for event-0"}],"rawEndN":9,"rawSliceSpan":10,"rawStartN":0,"sliceDigest":"b7c8b8230426e2c8d00a84fbfe23dcffbb33a16fe1a44e3e13dd38718a84bd4e","timestampEndUtc":"2026-03-07T00:00:10\u002B00:00","timestampStartUtc":"2026-03-07T00:00:00\u002B00:00","universeStates":{"cryptic-support":{"bloom":0.5,"drift":0.2,"pressure":0.3},"prime-projection":{"bloom":0.4,"drift":0.1,"pressure":0.2}}},{"artifactId":"71ee9640-daa7-4abd-8980-83bc53607f14","eventSliceId":"event-1","n":1,"observedEventCount":90,"protectedEvidenceRefs":[{"digestSha256":"7a3c2ec43254af940fb2ea1bc28af1d1d76fa0d5dd07aba2a5703723021d2786","pointerUri":"custody://observed/event-1","refId":"event-1","summary":"Protected evidence for event-1"}],"rawEndN":19,"rawSliceSpan":10,"rawStartN":10,"sliceDigest":"c44c2663edd3b667fb0b4bb2a689b490bcec70454225a2fb64879fabb1df3916","timestampEndUtc":"2026-03-07T00:00:20\u002B00:00","timestampStartUtc":"2026-03-07T00:00:10\u002B00:00","universeStates":{"cryptic-support":{"bloom":0.4,"drift":0.1,"pressure":0.1},"prime-projection":{"bloom":0.7,"drift":0.3,"pressure":0.45}}},{"artifactId":"71ee9640-daa7-4abd-8980-83bc53607f14","eventSliceId":"event-2","n":2,"observedEventCount":100,"protectedEvidenceRefs":[{"digestSha256":"a216c2c3222b04b201c3de1ad01d5af6ffab2369080cbfd9229717c6715df6c0","pointerUri":"custody://observed/event-2","refId":"event-2","summary":"Protected evidence for event-2"}],"rawEndN":29,"rawSliceSpan":10,"rawStartN":20,"sliceDigest":"8b2ccdb57e766b95346b0ac577d7d625682616f3366437d615c1395c85821040","timestampEndUtc":"2026-03-07T00:00:30\u002B00:00","timestampStartUtc":"2026-03-07T00:00:20\u002B00:00","universeStates":{"cryptic-support":{"bloom":0.65,"drift":0.3,"pressure":0.4},"prime-projection":{"bloom":0.9,"drift":0.35,"pressure":0.5}}},{"artifactId":"71ee9640-daa7-4abd-8980-83bc53607f14","eventSliceId":"event-3","n":3,"observedEventCount":110,"protectedEvidenceRefs":[{"digestSha256":"2df18881d4faa3723ed241802781a42f117fb5638ff4d8520e564380911d8f6c","pointerUri":"custody://observed/event-3","refId":"event-3","summary":"Protected evidence for event-3"}],"rawEndN":39,"rawSliceSpan":10,"rawStartN":30,"sliceDigest":"b60c34452fec6f0e1d06c8bd09c887332b85b1fd9505f03f392f296c18ceecd5","timestampEndUtc":"2026-03-07T00:00:40\u002B00:00","timestampStartUtc":"2026-03-07T00:00:30\u002B00:00","universeStates":{"cryptic-support":{"bloom":0.8,"drift":0.4,"pressure":0.55},"prime-projection":{"bloom":0.6,"drift":0.15,"pressure":0.38}}}]}