{"artifactId":"742c3cdd-d04d-49e8-a7f9-d783d178faac","observedSet":{"artifactId":"742c3cdd-d04d-49e8-a7f9-d783d178faac","baseSliceCadenceMs":1000,"dataCustodyMode":"protected_external","eventGroupingMode":"fixed_raw_count","eventGroupingSizeRawSlices":10,"observedDurationMs":40000,"observedEventCount":420,"observedSetId":"742c3cdd-d04d-49e8-a7f9-d783d178faac-observed","primeSafeInspectionMode":"metadata_only","protectedEvidenceRefs":[{"digestSha256":"c5833d543c20b4e9b9e2b008ed804e97aab88f8eebb020df01662cbab9bfebfa","pointerUri":"custody://observed/root","refId":"observed-root","summary":"Observed-set custody root"}],"rawSliceCount":40},"schema":"oan.hopng_event_slice","schemaVersion":"0.1.0","slices":[{"artifactId":"742c3cdd-d04d-49e8-a7f9-d783d178faac","eventSliceId":"event-0","n":0,"observedEventCount":120,"protectedEvidenceRefs":[{"digestSha256":"76676332cfa313b586ed553364beab22b7ea28c0204dd4d07aa138d9fdd2feea","pointerUri":"custody://observed/event-0","refId":"event-0","summary":"Protected evidence for event-0"}],"rawEndN":9,"rawSliceSpan":10,"rawStartN":0,"sliceDigest":"ca1297358deeeb18e24cf7fea4dab447467e39974cc111864e870736f5a0d5e2","timestampEndUtc":"2026-03-07T00:00:10\u002B00:00","timestampStartUtc":"2026-03-07T00:00:00\u002B00:00","universeStates":{"cryptic-support":{"bloom":0.5,"drift":0.2,"pressure":0.3},"prime-projection":{"bloom":0.4,"drift":0.1,"pressure":0.2}}},{"artifactId":"742c3cdd-d04d-49e8-a7f9-d783d178faac","eventSliceId":"event-1","n":1,"observedEventCount":90,"protectedEvidenceRefs":[{"digestSha256":"7a3c2ec43254af940fb2ea1bc28af1d1d76fa0d5dd07aba2a5703723021d2786","pointerUri":"custody://observed/event-1","refId":"event-1","summary":"Protected evidence for event-1"}],"rawEndN":19,"rawSliceSpan":10,"rawStartN":10,"sliceDigest":"0ad69d8e262fdedac4b9c30021298949087fca4910e9c80c3673fc05df740fb9","timestampEndUtc":"2026-03-07T00:00:20\u002B00:00","timestampStartUtc":"2026-03-07T00:00:10\u002B00:00","universeStates":{"cryptic-support":{"bloom":0.4,"drift":0.1,"pressure":0.1},"prime-projection":{"bloom":0.7,"drift":0.3,"pressure":0.45}}},{"artifactId":"742c3cdd-d04d-49e8-a7f9-d783d178faac","eventSliceId":"event-2","n":2,"observedEventCount":100,"protectedEvidenceRefs":[{"digestSha256":"a216c2c3222b04b201c3de1ad01d5af6ffab2369080cbfd9229717c6715df6c0","pointerUri":"custody://observed/event-2","refId":"event-2","summary":"Protected evidence for event-2"}],"rawEndN":29,"rawSliceSpan":10,"rawStartN":20,"sliceDigest":"efb35fb0d6fd2a43c58dc7feb7547b3ba98622a06815772ce063f24859c0e5a2","timestampEndUtc":"2026-03-07T00:00:30\u002B00:00","timestampStartUtc":"2026-03-07T00:00:20\u002B00:00","universeStates":{"cryptic-support":{"bloom":0.65,"drift":0.3,"pressure":0.4},"prime-projection":{"bloom":0.9,"drift":0.35,"pressure":0.5}}},{"artifactId":"742c3cdd-d04d-49e8-a7f9-d783d178faac","eventSliceId":"event-3","n":3,"observedEventCount":110,"protectedEvidenceRefs":[{"digestSha256":"2df18881d4faa3723ed241802781a42f117fb5638ff4d8520e564380911d8f6c","pointerUri":"custody://observed/event-3","refId":"event-3","summary":"Protected evidence for event-3"}],"rawEndN":39,"rawSliceSpan":10,"rawStartN":30,"sliceDigest":"8ce74b0a0ef1fd9b3a88d2541422d1262871d34d3aa49fde22065f8c945fe2f0","timestampEndUtc":"2026-03-07T00:00:40\u002B00:00","timestampStartUtc":"2026-03-07T00:00:30\u002B00:00","universeStates":{"cryptic-support":{"bloom":0.8,"drift":0.4,"pressure":0.55},"prime-projection":{"bloom":0.6,"drift":0.15,"pressure":0.38}}}]}